ID;Name;Beschreibung;Art;Ort_Name;Adresse;Latitude;Longitude;Preis_Ca;Preis_Info;Wetter_Praeferenz;Datum_Von;Datum_Bis;Indoor_Outdoor;Zielgruppe;Dauer_Info;Website;Kontakt_Telefon;Booking_Info;Image_URL
1;Stiftsbibliothek St. Gallen;Besuch der weltberühmten Stiftsbibliothek (UNESCO-Weltkulturerbe) mit Barocksaal.;Kultur;St. Gallen;Klosterhof 6D;47.42320366;9.376517375;18;pro Person (Erwachsene), Reduktionen verfügbar;Egal;;;Indoor;Senioren, Kulturinteressierte, Touristen;1-2 Stunden;https://www.stiftsbezirk.ch;+41 71 227 33 90;Nicht nötig;https://lh3.googleusercontent.com/p/AF1QipP56zJg97UWK8beLyZReCg0mrj0l8HWe9CULPLZ=w408-h267-k-no
2;Maestrani Chocolarium;Maestrani Chocolarium ist die Erlebniswelt der Schokolade in Flawil, wo Besucher die süße Welt von Maestrani hautnah entdecken können. In interaktiven Ausstellungen und bei gläserner Produktion wird gezeigt, wie Schokolade entsteht – Probieren ausdrücklich erlaubt. Das Angebot richtet sich an Familien, Schulklassen, Geniesser und Schokoladenliebhaber jeden Alters.;Freizeit;Flawil;Toggenburgerstrasse 41;47.41368195;9.165307432;16;pro Person (Erwachsene), Reduktionen verfügbar;Egal;;;Indoor;Familie, Kinder, Touristen;1-2 Stunden;https://www.chocolarium.ch/;+41 71 228 38 88;Ticket im Voraus kaufen;https://lh3.googleusercontent.com/gps-cs-s/AB5caB_mFC5F5Dsy6ixCG_I_taWE8DUdZXPDXmP8LpVTHISUR0CHr5Bp2WwAe9JxuDLIAgzzSjTDRS7SknvEIEE_0KZ93nKJOUzKl_RBUfS5HYSEkEG8tj-3M-XrU1ep22OpXjuJPRE=w520-h240-k-no
3;Walter Zoo;Der Walter Zoo in Gossau ist ein familienfreundlicher Tierpark mit einer Vielzahl an exotischen und einheimischen Tieren. Neben artgerechter Tierhaltung gibt es spannende Erlebnispfade und ein Streichelzoo. Ein tolles Ausflugsziel für Naturfreunde und Kinder.;Familie;Gossau;Neuchlenstrasse 200;47.41982049;9.28578847;28;pro Person (Erwachsene), Reduktionen verfügbar;Nur Sonne;;;Outdoor;Kinder, Familie, Touristen;2 Stunden;http://www.walterzoo.ch/;+41 71 387 50 50;Nicht nötig;https://lh3.googleusercontent.com/p/AF1QipMBFqwGQGNispvI6k3KWPxnlrl-fuuEE29d4jQS=w408-h305-k-no
4;Textilmuseum St. Gallen;Das Textilmuseum zeigt die lange Tradition der Ostschweizer Textilindustrie. Besucher entdecken kunstvolle Stickereien, historische Maschinen und wechselnde Ausstellungen. Ideal für Kulturinteressierte und Geschichtsfreunde.;Kultur;St. Gallen;Vadianstrasse 2;47.42409872;9.373651662;12;pro Person (Erwachsene), Reduktionen verfügbar;Egal;;;Indoor;Touristen, Kulturinteressierte, Senioren;1 Stunde;https://www.textilmuseum.ch/;0712280010;Nicht nötig;https://lh3.googleusercontent.com/gps-cs-s/AB5caB8u4Qupn_eOTsKlsDN2gYXjNXDyQ6e6X6gASTRRayOJM2sfHNwSKF5E3zR8PNvKmbozisVOZZ494gwFXYocSoeTRpaL4ANhycMHmvaE3JfPrernQKot0SV_LlECfA4mUeBGYrIkLg=w408-h306-k-no
5;Kathedrale St. Gallen;Die barocke Kathedrale St. Gallen ist Teil des UNESCO-Weltkulturerbes und beeindruckt mit prachtvoller Architektur. Besucher können die reich verzierte Decke, die Krypta und die berühmte Stiftsbibliothek entdecken. Ein Muss für jeden Kulturliebhaber.;Kultur;St. Gallen;Klosterhof 6;47.42316069;9.376709345;;;Egal;;;Indoor;Touristen, Kulturinteressierte, Senioren;;https://www.stiftsbezirk.ch/en/cathedral-information;0712240550;Nicht nötig;https://lh3.googleusercontent.com/gps-cs-s/AB5caB8a1UBIlP5rm_yF_MSaabrrEvGgMyalzMYjDsfFBKVN11VjqMkS83Gibif30sD1lL57wX4oUf5joPDceeIXbAX-mVE86jvQhXFYW6joydjkJAQ2smAkJ-izALiuRrBDpARxnjJ_=w408-h541-k-no
6;Escape Company & Bar;Ein spannendes Erlebnis erwartet Gruppen in der Escape Company in St. Gallen. Teamwork und logisches Denken stehen im Mittelpunkt, um aus kreativ gestalteten Räumen zu entkommen. Perfekt für Freunde, Firmen oder Events.;Entertainment;St. Gallen;Unterer Graben 1;47.42642693;9.374060269;40;pro Person;Egal;;;Indoor;Studenten, Freunde, Jugendliche, Familie;1 Stunde;https://escapecompany.ch/stgallen.html?utm_source=google&utm_medium=maps&utm_campaign=gmbstgallen;0717223355;Anmeldung erforderlich;https://lh3.googleusercontent.com/p/AF1QipPepQIy6dUrJ4xUZydRsXvv3DU_RzC8rMy39Vbm=w408-h305-k-no
7;Drei Weieren;Die Drei Weieren sind idyllisch gelegene Naturbadeseen oberhalb von St. Gallen. Sie laden im Sommer zum Schwimmen ein und bieten das ganze Jahr über eine herrliche Aussicht auf die Stadt. Ein Ort der Erholung für Einheimische und Touristen.;Freizeit;St. Gallen;Bitzistrasse 65a;47.42148139;9.386423397;;;Nur Sonne;;;Outdoor;Familie, Paare, Studenten, Senioren, Alle;;;;Nicht nötig;https://streetviewpixels-pa.googleapis.com/v1/thumbnail?panoid=XgIvkXl5Y5w0CR_TfeX63w&cb_client=search.gws-prod.gps&w=408&h=240&yaw=285.9175&pitch=0&thumbfov=100
8;Wildpark Peter und Paul;Der Wildpark Peter und Paul in St. Gallen beherbergt einheimische Tierarten wie Luchse, Hirsche und Steinböcke in naturnahen Gehegen. Der Eintritt ist kostenlos, und die weitläufige Anlage liegt idyllisch am Hang mit Panoramablick über die Stadt. Der Park eignet sich hervorragend für Familienausflüge und ruhige Naturbeobachtungen.;Natur;St. Gallen;Kirchlistrasse 99;47.44871254;9.389697524;;;Nur Sonne;;;Outdoor;Kinder, Familie, Touristen, Alle;1 Stunde;http://www.wildpark-peterundpaul.ch/;0712445113;Nicht nötig;https://lh3.googleusercontent.com/gps-cs-s/AB5caB8JerZ77352sfrPzkfG5i47e3PT3yvfqxCuAqhfDyl_yuy-stkia6sl2lQLTPhZOII9EkZCQjbwkf0MG8hxjgfbu3IA5Bfm43-a5UiBCciwvi4C6zVKqKyDl8gabqw6Sc6xcXTh=w408-h306-k-no
9;Trampolinpark Rorschach;Der Trampolingpark in Rorschach bietet eine moderne Halle voller Trampoline, Sprungtürme und Hindernisparcours. Kinder, Jugendliche und Erwachsene können hier ihre Sprungkraft und Geschicklichkeit austesten. Die Anlage ist ideal für sportliche Aktivitäten, Kindergeburtstage und Gruppenevents bei jedem Wetter.;Action;Rorschach;Industriestrasse 21;47.47728662;9.4848667;16;pro Person;Egal;;;Indoor;Familie, Sportliche, Kinder, Jugendliche, Freunde;1.5 Stunden;https://www.trampolinpark.ch/;0718455500;Telefonisch reservieren;https://lh3.googleusercontent.com/gps-cs-s/AB5caB8pAY-1GzIX-Yuac6dOlOpHgMzX9_lJ41hbIA7ZmYSDQ5Kj5lnojxk2dwsyHFoIkn-gl8Exwnfy65S9kGZY_wdFm9N-FRd6GDeC3ZDQN37kWFtMCLtih9x5JyjwwjYzuUZaYcIH=w408-h306-k-no
10;Tanoshii Funpark;Der Tanoshii Funpark ist ein Indoor-Freizeitpark in der Ostschweiz mit zahlreichen Attraktionen wie Hüpfburgen, Kletteranlagen und Rutschbahnen. Besonders Kinder können sich hier in sicherer Umgebung austoben, während Eltern im Café entspannen. Der Park bietet wetterunabhängigen Spielspaß für die ganze Familie.;Action;Altstätten;Schöntalstrasse 2;47.37989875;9.548020638;24;pro Person;Egal;;;Indoor;Familie, Sportliche, Kinder, Jugendliche, Freunde;1.5 Stunden;http://tanoshii.ch/;;Online buchen;https://lh3.googleusercontent.com/p/AF1QipO27lCLtiIsv3Ni9jEicMTMAa_G4eA6u37aKNAR=w408-h272-k-no
11;Kunstmuseum;Das Kunstmuseum St. Gallen zeigt bedeutende Werke aus verschiedenen Epochen mit Schwerpunkten auf zeitgenössischer und klassischer Kunst. Besucher erleben hier wechselnde Ausstellungen, thematische Führungen und kulturelle Veranstaltungen. Es ist ein zentraler Treffpunkt für Kunstinteressierte und kulturell Neugierige.;Kultur;St. Gallen;Museumstrasse 32;47.42851139;9.381555731;12;pro Person (Erwachsene), Reduktionen verfügbar;Egal;;;Indoor;Kulturinteressierte, Touristen, Senioren;2 Stunden;http://www.kunstmuseumsg.ch/;0712420671;Nicht nötig;https://lh3.googleusercontent.com/gps-cs-s/AB5caB_NibEg6iILiwPQPOajYlg8Lym4FaWyY_p2v8nugyxAZ5wCG-PFpJj7Mf7Q-xT14tt5P3ktceEFWkK3hahy-dXmXOudJq6hZaQJ4Z4ZQnYsCto2_zyq5CvbVtB98e896x8JnsU=w408-h306-k-no
12;ROOM Escape Room;Der ROOM Escape Room in St. Gallen bietet spannende Rätselräume, bei denen Teams gemeinsam Hinweise entschlüsseln und Aufgaben lösen müssen, um innerhalb einer Stunde zu entkommen. Die Räume sind thematisch gestaltet und fördern Kommunikation und logisches Denken. Eine ideale Aktivität für Freunde, Firmen oder Teambuilding-Events.;Entertainment;St. Gallen;Bohl 9;47.42662745;9.376897645;40;pro Person;Egal;;;Indoor;Studenten, Freunde, Jugendliche, Familie;1 Stunde;https://roomescaperoom.ch/escape-room-st-gallen/;+41 71 521 01 16;Anmeldung erforderlich;https://lh3.googleusercontent.com/p/AF1QipNY3VlkAy97iVrpKLGYRIf3IErz6meXUkQMuo_d=w426-h240-k-no
13;Naturmuseum St. Gallen;Das Naturmuseum St. Gallen vermittelt spannende Einblicke in die Tier- und Pflanzenwelt der Schweiz. Interaktive Ausstellungen und naturgetreue Dioramen machen den Besuch auch für Kinder und Familien interessant. Neben Sonderausstellungen bietet das Museum ein breites Bildungsprogramm.;Kultur;St. Gallen;Rorschacher Strasse 263;47.43967136;9.408844755;12;pro Person (Erwachsene), Reduktionen verfügbar;Egal;;;Indoor;Kulturinteressierte, Senioren, Touristen, Familie;2 Stunden;http://www.naturmuseumsg.ch/;0712434040;Nicht nötig;https://lh3.googleusercontent.com/p/AF1QipOxW50GyZwRcr9TbxyCrV6S5QQiIRREzq-EdPZt=w408-h267-k-no
14;Bauwipfelpfad Neckertal;Der Baumwipfelpfad Neckertal führt Besucher auf luftiger Höhe durch die Baumkronen des Neckertals. Auf dem rund 500 Meter langen Weg gibt es Infotafeln über Flora, Fauna und Nachhaltigkeit. Ein Highlight für Naturfreunde, Familien und Schulklassen.;Natur;Mogelsberg;Lettenstrasse 19;47.35889278;9.143736646;15;pro Person (Erwachsene), Reduktionen verfügbar;Nur Sonne;;;Outdoor;Familie, Naturfreunde, Jugendliche, Kinder;1 Stunde;http://www.baumwipfelpfad.ch/;0715523303;Nicht nötig;https://lh3.googleusercontent.com/p/AF1QipNBeLLLahHgx0tcbCLa8unwd6fXwgYiahi4BQ1N=w408-h306-k-no
15;Boulderlounge St. Gallen;Die Boulderlounge in St. Gallen ist eine moderne Indoor-Kletterhalle, die sich auf Bouldern – Klettern ohne Seil in Absprunghöhe – spezialisiert. Mit Routen für Einsteiger bis Profis und einem gemütlichen Bistro ist sie ein beliebter Treffpunkt für Sportbegeisterte. Auch Kinder und Jugendliche finden hier eigene Bereiche.;Sport;St. Gallen;Zürcherstrasse 160;47.41520472;9.339896692;20;pro Person (Erwachsene), Reduktionen verfügbar;Egal;;;Indoor;Jugendliche, Freunde, Studenten, Sportliche;2 Stunden;http://www.boulderlounge.ch/stgallen;0715112347;Nicht nötig;https://lh3.googleusercontent.com/p/AF1QipON3yKHvnARKAqk9AObgtE3DO1giowIA6pOPEWa=w426-h240-k-no
16;Sparta Bouldering & Bar;Sparta Bouldering & Bar kombiniert sportliches Bouldern mit urbaner Atmosphäre und einer gemütlichen Bar. Neben abwechslungsreichen Boulderwänden gibt es Events und Musikabende. Ein Treffpunkt für aktive Menschen, die Sport und Geselligkeit schätzen.;Sport;Buchs;Fabrikstrasse 16;47.17232419;9.482718168;22;pro Person (Erwachsene), Reduktionen verfügbar;Egal;;;Indoor;Jugendliche, Freunde, Studenten, Sportliche;2 Stunden;http://www.sparta-bouldering.com/;0817562222;Nicht nötig;https://lh3.googleusercontent.com/p/AF1QipNws3bSzG7QXpXxGI8-Qul5Q7UNXGXABXiIsLuA=w457-h240-k-no
17;Seerenbachfälle;Die Seerenbachfälle zählen mit über 600 Metern Fallhöhe zu den höchsten Wasserfällen Europas. Die drei Wasserstufen stürzen spektakulär in die Tiefe und lassen sich über Wanderwege und Aussichtspunkte bestaunen. Ideal für Tagesausflüge und Naturliebhaber.;Natur;Amden;;47.13874447;9.164811807;;;Nur Sonne;15.04.2025;15.10.2025;Outdoor;Touristen, Naturfreunde, Freunde, Paare, Familie;;https://www.amden-weesen.ch/attraktion/seerenbachfaelle-rinquelle-die-wasserfaelle-am-walensee-7265d13daa;0582282830;Nicht nötig;https://lh3.googleusercontent.com/gps-cs-s/AB5caB_JXbkMJgy7G19LYdEjeRUkTnovI8SlBv-3AdIE_W_cuzrQBPEmS12iYUB9-1iAPUj1zs0JjUmR_7tX2-ZQ4RIHoucCTOHiaDj0XUpN275cvDdoEdCvd4HX6bheKhLuaH0T2xNH6g=w408-h306-k-no
18;Paxmal;Das Paxmal bei Walenstadt ist ein monumentales Friedensdenkmal mit beeindruckender Symbolik und Panorama-Blick auf die Churfirsten. Erbaut vom Künstler Karl Bickel, lädt der Ort zur stillen Reflexion und Auseinandersetzung mit dem Thema Frieden ein. Besonders Kulturinteressierte und spirituelle Besucher finden hier einen inspirierenden Platz.;Sightseeing;Walenstadt;Grundweg 9;47.14218202;9.270264682;;;Nur Sonne;15.04.2025;15.10.2025;Outdoor;Touristen, Naturfreunde, Freunde, Paare, Familie;;https://www.museumbickel.ch/index.php/paxmal;0817102777;Nicht nötig;https://lh3.googleusercontent.com/gps-cs-s/AB5caB9pt0HOrMmwLpl5vmnP4KuhH3K1YcBSq8fKpl8pdtj1abY1NSQJi1zJ-YTU1uoo_5mzmQ-BYpFYSxSEd07513nfe5vxzMjmt8sWo73FSwG5XDQXjgeG2r2pHTgZtxXVCvQWkGt8=w408-h306-k-no
19;Holzbrücke Rapperswil-Hurden;Die Holzbrücke zwischen Rapperswil und Hurden führt über den Zürichsee und gilt als älteste Brückenverbindung der Schweiz, heute rekonstruiert. Der Spaziergang über das Wasser bietet historische Infotafeln und tolle Ausblicke. Ein ruhiges Erlebnis für Spaziergänger, Familien und Geschichtsfreunde.;Sightseeing;Rapperswil-Jona;;47.22088591;8.812211569;;;Nur Sonne;;;Outdoor;Touristen, Naturfreunde, Freunde, Paare, Familie;;https://www.rapperswil-jona.ch/naherholungimfreien/6552;0552257000;Nicht nötig;https://lh3.googleusercontent.com/gps-cs-s/AB5caB9M_xVN91odtvmnUlgLqDXUPdR-NEWhOyabnKX-UkXYsy1o3PiFQEGuBkAflNuu1HO36nKaiFsxjx894zktZ-SVmT8_kivT1Ftlr04bGxmrjVtxrsrxHa_ZaZ6C1-Ke4jVrwZ1mww=w408-h272-k-no
20;Wiler Turm;Der Wiler Turm ist ein moderner Aussichtsturm im Toggenburg mit weitem Blick über das Thurgebiet bis hin zu den Alpen. Der Zugang über eine spiralförmige Treppe ist Teil des Erlebnisses. Der Turm ist ein beliebtes Ziel für Wanderer und Ausflügler.;Freizeit;Bronschhofen;Antennenweg;47.4786522;9.049277222;;;Nur Sonne;;;Outdoor;Geniesser, Studenten, Paare, Familie, Touristen;;;;Nicht nötig;https://lh3.googleusercontent.com/gps-cs-s/AB5caB9Vhva7VCYP_yH0ZGJ398jn5pTraV95GLGpdqrHSaBdCafKrdpE4J73n2mEaDZZ7sa1rZM3i3td4yXuQ8NAQQptA5fSQzlEXiyA6_fM0C1pNEkpidRMePT-cUGrNCa8nlmywO2W=w408-h544-k-no
21;Schloss Werdenberg;Schloss Werdenberg thront über einem mittelalterlichen Städtchen und beherbergt heute ein Museum zur regionalen Geschichte. Die gut erhaltene Anlage bietet faszinierende Einblicke in das Leben vergangener Jahrhunderte. Ideal für Kulturliebhaber und Familienausflüge.;Kultur;Werdenberg;Schlossweg;47.16856242;9.461650317;14;pro Person (Erwachsene);Nur Sonne;;;Outdoor;Touristen, Kulturinteressierte, Senioren;;http://www.schloss-werdenberg.ch/;0817400540;Nicht nötig;https://lh3.googleusercontent.com/p/AF1QipPnQYSB1nNGP6pThQUM44sNbqqjPWgvmwtISjKC=w408-h306-k-no
22;IWC Schaffhausen Museum;Das IWC Museum in Schaffhausen gibt einen exklusiven Einblick in die Geschichte der Luxusuhrmacherei. Besucher erleben ikonische Modelle, technische Meisterwerke und die Philosophie der Marke. Eine edle Mischung aus Technik, Design und Zeitgeschichte.;Sightseeing;Schaffhausen;Baumgartenstrasse 15;47.69459354;8.636891843;6;pro Person (Erwachsene), Reduktionen verfügbar;Egal;;;Indoor;Touristen, Kulturinteressierte, Senioren;1 Stunde;https://www.iwc.com/en/company/museum.html;+41 52 235 75 65;Nicht nötig;https://www.iwc.com/content/dam/brand/museum/museum-2-4x3.jpg.transform.global_image_png_940_2x.jpg
23;Walensee;Der Walensee bietet türkisfarbenes Wasser umrahmt von steilen Felswänden und idyllischen Dörfern. Er lädt zu Bootsfahrten, Wanderungen und Badeausflügen ein. Ideal für Naturfreunde und alle, die Erholung am Wasser suchen.;Natur;Walenstadt;;47.12613752;9.302242101;;;Nur Sonne;;;Outdoor;Freunde, Jugendliche, Familie, Paare, Kinder, Alle;;;;Nicht nötig;https://lh3.googleusercontent.com/gps-cs-s/AB5caB_Pqzf4s_QgW3vs4yhegov1GyjfcPD6vZIlI_eY1E61eSsHKky_B8Nw2yvL5m2PeZAjyCzPNOiBMmCuYWEgLH4Dho44t6rvIAvu3SgO2MJB8Z7Jfrl7Rb4j1ZIV-xdIpxrOI1Zw=w408-h306-k-no
24;Klangweg Toggenburg;Der Klangweg im Toggenburg verbindet Wandern mit Klanginstallationen aus Holz, Metall und Stein. Familien und Schulklassen erleben spielerisch Musik und Natur. Die Route ist leicht begehbar und landschaftlich reizvoll.;Freizeit;Alt St. Johann;;47.18131034;9.3203026;39;pro Person (Erwachsene);Nur Sonne;31.05.2025;31.10.2025;Outdoor;Sportliche, Naturfreunde, Wanderer, Familie;3-4 Stunden;https://klangwelt.swiss/de/klangwelt-erleben/klangweg.html;+41 71 998 50 00;Nicht nötig;https://lh3.googleusercontent.com/p/AF1QipPv8tiMnrc_u5EHr9OZFS0pMT4TvKA9kCjLt6rr=w408-h242-k-no
25;Barfussweg Gonten;Der Barfussweg Gonten führt durch Wiesen, Wasserläufe und unterschiedliche Bodenbeläge. Er stimuliert die Sinne und bietet eine entspannende Erfahrung für Groß und Klein. Eine naturnahe Aktivität mit Gesundheitsaspekt.;Natur;Gontenbad;Paradiesstrasse 6;47.33122702;9.372386096;;;Nur Sonne;30.04.2025;30.09.2025;Outdoor;Wanderer, Naturfreunde, Sportliche, Paare;1.5 Stunden;http://www.kronberg.ch/de/angebote_sommer/barfussweg.html;;Nicht nötig;https://lh3.googleusercontent.com/gps-cs-s/AB5caB95mGR3Yy289BqASEEdtZxqrrybXMcERcDz2Crf-u6kUvQAKT6IHDvr1zk5DTXTMqP147yk--CMPJ-tJL0TrSE6jGw6F1VjNecESjWxOQqNm--BeJ_ZblCJE9uT8BVFJofajM8_=w408-h306-k-no
26;Kronberg Zipline-Park;Der Zipline-Park am Kronberg ermöglicht rasante Seilrutschenfahrten mit spektakulärem Blick über die Appenzeller Hügel. Die Anlage ist sicher, gut betreut und für Abenteuerlustige ein echtes Highlight. Perfekt für Actionfans und Gruppenaktivitäten.;Sport;Jakobsbad;St. Josefstrasse 2;47.31947175;9.328968262;31;pro Person (Erwachsene);Nur Sonne;;;Outdoor;Familie, Touristen, Kinder, Sportliche, Jugendliche, Paare;2 Stunden;https://www.kronberg.ch/zipline;0717941289;Online buchen;https://lh3.googleusercontent.com/p/AF1QipND8Q3CwXpDqyG3BKO29kyGMc9hoE1VsczzA7Yr=w408-h271-k-no
27;Autobau Erlebniswelt;Die Autobau Erlebniswelt in Romanshorn zeigt historische und moderne Traumautos in einem architektonisch beeindruckenden Gebäude. Besucher können teils interaktiv in die Welt des Motorsports eintauchen. Ein Muss für Technik- und Autobegeisterte.;Freizeit;Romanshorn;Egnacherweg 7;47.55803432;9.376409023;22.5;pro Person (Erwachsene), Reduktionen verfügbar;Egal;;;Indoor;Firmen, Kulturinteressierte, Jugendliche;2 Stunden;https://www.autobau.ch/;0714660066;Online buchen;https://lh3.googleusercontent.com/p/AF1QipP4ft_Eb3soVgUf1hcnXLYOFv--wr2FbL2PjYyN=w426-h240-k-no
28;Rheinfall;Der Rheinfall ist der größte Wasserfall Europas und beeindruckt mit donnerndem Wassermassen. Plattformen, Bootsfahrten und ein Schlossbesuch bieten vielseitige Perspektiven. Ein spektakuläres Naturwunder für alle Altersgruppen.;Sightseeing;Neuhausen am Rheinfall;Rheinfallquai 5;47.67918218;8.611755134;;;Nur Sonne;;;Outdoor;Familie, Kulturinteressierte, Geniesser, Touristen;;https://www.bodensee.de/ausflugsziele/rheinfall;;Nicht nötig;https://lh3.googleusercontent.com/gps-cs-s/AB5caB-M7xo-28cqyZuxVja-vj28Vnmwzu5qRL7biXWVQCUMjDKFHz-mXrlQyNupkcRk-4t2A7X-_Qc3pTcLAB1nFxXLtZjftyxljQC0sUWC51XtBA1Jws-5gyCQzHCU-UEF-9HmNbPq-Q=w408-h306-k-no
29;Adventure Park Rheinfall;Direkt beim Rheinfall gelegen bietet der Adventure Park verschiedene Kletterparcours in den Baumwipfeln. Mit Seilrutschen und Hängebrücken ist Adrenalin garantiert. Besonders für sportliche Familien und Gruppen geeignet.;Sport;Neuhausen am Rheinfall;Nohlstrasse;47.67840757;8.609425984;41;pro Person (Erwachsene);Nur Sonne;15.03.2025;31.10.2025;Outdoor;Kinder, Familie, Touristen, Paare, Sportliche;3 Stunden;https://www.ap-rheinfall.ch/;0526701960;Online reservieren;https://lh3.googleusercontent.com/p/AF1QipPMyN5-mQWIS_GcZxwnw6UnpdxVPjEEDPnCMElX=w408-h306-k-no
30;Badewelt Säntispark;Die Badewelt Säntispark in Abtwil ist ein familienfreundiges Erlebnisbad mit Rutschen, Wellenbad und Wellnessbereich. Kinder und Erwachsene finden hier gleichermaßen Spaß und Erholung. Ideal bei jedem Wetter.;Familie;Abtwil;Wiesenbachstrasse 9;47.41939357;9.315612031;34;pro Person (Erwachsene), Reduktionen verfügbar;Egal;;;Mixed;Touristen, Kinder, Familie, Paare, Alle;2 Stunden;https://saentispark-freizeit.ch/baeder/;0587125500;Nicht nötig;https://lh3.googleusercontent.com/p/AF1QipPkwHA0sHGVS8gxF7raCClGH9SXMyB9M4rKGm5K=w408-h408-k-no
31;Seilpark Gründenmoos;Der Seilpark Gründenmoos bei St. Gallen bietet abwechslungsreiche Kletterelemente in luftiger Höhe. Die Parcours variieren in Schwierigkeit und sind auch für Kinder geeignet. Sportliche Herausforderung trifft auf Spaß im Grünen.;Sport;Abtwil;Gründenstrasse;47.41464601;9.306394919;35;pro Person (Erwachsene);Nur Sonne;15.04.2025;31.10.2025;Outdoor;Kinder, Familie, Touristen, Paare, Sportliche;3 Stunden;https://seilpark-sg.ch/;0587125504;Online reservieren;https://lh3.googleusercontent.com/p/AF1QipNltWvO2awgzBGigXIM4eszzZc2bWpuwbRe9DtM=w408-h272-k-no
32;Kronberg Bobbahn;Die Sommerrodelbahn am Kronberg schlängelt sich rasant ins Tal und bietet Kurvenspaß für Jung und Alt. Die Bahn ist sicher konstruiert und mit Bremsen steuerbar. Ein beliebter Ausflugsspaß in der Ostschweiz.;Action;Jakobsbad;St. Josefstrasse 2;47.31997006;9.328417469;9;pro Person pro Fahrt (Erwachsene);Nur Sonne;;;Outdoor;Kinder, Familie, Touristen, Paare, Sportliche;;http://www.kronberg.ch/bobbahn;0717941289;Nicht nötig;https://lh3.googleusercontent.com/gps-cs-s/AB5caB8ckVxrZfRiLOvGE2UbLTmikH5N-qG4H0FynwZT_cmLvlnZsizngcl2g2nGnEzqmw08FTKIIiJlVVDgQTUgTcY5W-5eGJ0mGCkWeR7zJBvGbZRWmgSIHs1dRXJv609DoJBOwHGW=w408-h521-k-no
33;Tamina-Therme;Die Tamina-Therme in Bad Ragaz kombiniert moderne Architektur mit heilendem Thermalwasser. Innen- und Außenbecken sowie ein vielfältiger Saunabereich laden zur Erholung ein. Ein Ort für Entspannung und Gesundheitsförderung.;Wellness;Bad Ragaz;Hans Albrecht-Strasse;46.99987497;9.504414877;85;pro Person;Egal;;;Indoor;Paare, Geniesser, Senioren;1 Tag;https://www.taminatherme.ch/wellness-erlebnis;0813032740;Online buchen;https://lh3.googleusercontent.com/p/AF1QipMCMosAC0eeZ8sRDwniLwrWpuymFgs9-AGoTI8v=w408-h272-k-no
34;Biberlehrpfad;Der Biberlehrpfad informiert auf einem Naturlehrpfad über das Leben des Bibers. Besucher entdecken Lebensräume, Spuren und Biberbauten entlang des Weges. Besonders geeignet für Familien und Schulklassen.;Natur;Oberbüren;Thurweg;47.45986065;9.158781821;;;Nur Sonne;;;Outdoor;Freunde, Paare, Wanderer, Naturfreunde, Familie;3 Stunden;http://www.wwfost.ch/themen-projekte/artenvielfalt/biber/sg-biberlehrpfad/;;Nicht nötig;https://lh3.googleusercontent.com/gps-cs-s/AB5caB_-w7__FzdinRvt1qs6DVFyjYLPrBfFPyawTJ74jRPTu-X9ujcpokRbfW1Y6y2SNturMVxpnNw5aP0pxCOtvtW73zZP5_RoEFao85K-Ew5Yd_7QEZzqT69QWN0Lo375nbpE9uizhw=w408-h839-k-no
35;Schweizerische Bodensee Schiffahrt;Die Bodensee-Schifffahrt verbindet Orte am See auf entspannte Weise. Mit Rundfahrten, Themenfahrten und Linienbetrieb ist sie bei Touristen sehr beliebt. Ein besonderes Erlebnis mit Seebrise und Aussicht.;Natur;Romanshorn;Hafenstrasse 6;47.56473633;9.380395486;;Variiert nach Destination;Nur Sonne;15.04.2025;15.10.2025;Outdoor;Paare, Geniesser, Senioren, Touristen;1 Tag;https://bodensee-schiffe.ch/;0714667888;Online buchen;https://lh3.googleusercontent.com/p/AF1QipNcMusoAkquiMskteYa2vunMrQNgSQBe8wjgjgm=w408-h272-k-no
36;Gesundheitsweg;Die sanften Hügel, das satte Grün, die verstreuten Siedlungen, all das fügt sich zusammen zu einer gesunden und intakten Landschaft. Geniessen Sie die typische Appenzeller Landschaft, prächtige Ausblicke ins Vorarlbergische, auf den Bodensee bis ins Allgäu. Erahnen und erleben Sie auf Ihrem Kräuterspaziergang, dass die besten Heilmittel für unseren Organismus aus der Natur entnommen sind.;Freizeit;Verschiedene Startpunkte;;47.42818388;9.508688392;;;Nur Sonne;15.03.2025;31.10.2025;Outdoor;Naturfreunde, Wanderer, Paare, Familie, Geniesser;1-3 Stunden;https://appenzellerland.ch/de/erleben/wandern-bewegen/sommer/wanderrouten/gesundheitsweg.html;;Nicht nötig;https://lh3.googleusercontent.com/gps-cs-s/AB5caB8iKoxEWLFm7F4cRVizo_7QE88u5wqtI6vZuIPC6fid-pz_AxnvWKg5tiI6JwWiQPBxsgSX15Nb4Mcyt3lZz8coeHLPDVQwKBzidrq98tyjATPLbq-sZxxbpmIREiCkxtULe9Hp=w408-h306-k-no
37;Klettersteig Braunwald;Der Klettersteig in Braunwald bietet gesicherte Routen entlang von Felsen mit Blick über das Glarnerland. Trittsicherheit und Schwindelfreiheit sind Voraussetzung. Für geübte Alpinisten ein intensives Erlebnis.;Sport;Braunwald;;46.96382431;8.97762217;52;pro Person (Erwachsene), beinhaltet Mietmaterial und Bahnticket;Nur Sonne;15.06.2025;28.10.2025;Outdoor;Sportliche, Wanderer, Naturfreunde;5 Stunden;https://www.braunwald.ch/Erlebnisse/Sommeraktivitaeten/Klettersteige-und-Klettern-in-Braunwald;;Nicht nötig;https://lh3.googleusercontent.com/gps-cs-s/AB5caB_IS88WFBB1ZzO1MgRvfODXI_ZB7Ae0Y0C7YrOGXx0Y7-e90wEG0JMwFe7vVfsytD78YI2P5t0oPxqs86vuwCXofLteYftMH08AwX9PODgBdi1WK3tuJj45il1yG_QfAnEms7Q=w408-h272-k-no
38;Taminaschlucht;Die Taminaschlucht beeindruckt mit engen Felswänden und türkisfarbenem Wasser. Ein gesicherter Weg führt Besucher bis zur Thermalquelle, die schon Paracelsus kannte. Ein magischer Ort mit historischer Bedeutung.;Natur;Bad Ragaz;Taminatal;46.97419353;9.487993536;5;pro Person;Nur Sonne;03.05.2025;19.10.2025;Outdoor;Kulturinteressierte, Naturfreunde, Familie, Touristen, Wanderer;2 Stunden;https://heidiland.com/de/informieren/regionen-orte/bad-ragaz/die-taminaschlucht.html#anreise_tamina;0817200820;Nicht nötig;https://heidiland.com/files/heidiland.com/UPLOAD-NEUE-MEDIEN/Johanna/Taminaschlucht/Weg%20durch%20die%20Taminaschlucht.jpg
39;ArboPark;Der ArboPark in Arbon ist der grösste Indoor-Freizeitpark der Schweiz und bietet auf über 6'000 m² mehr als 24 High-End-Attraktionen für Jugendliche und Erwachsene. Zu den Highlights zählen eine 240 Meter lange Elektro-Kartbahn, interaktives Minigolf, Augmented Reality Darts, die Valo Arena sowie die CUBE Challenges – thematisch gestaltete Räume für Teamspiele und Denkaufgaben. Der Park ist von Mittwoch bis Sonntag geöffnet und liegt nur zehn Gehminuten vom Bahnhof Arbon entfernt.;Freizeit;Arbon;Textilstrasse 7;47.50759868;9.429551937;65;pro Person (Erwachsene);Egal;;;Indoor;Kinder, Touristen, Familie, Sportliche;4 Stunden;https://www.arbopark.ch/;0715528000;Online buchen;https://lh3.googleusercontent.com/gps-cs-s/AB5caB-dYxIo_ypiadukltm-DDEw-LRtviU2ci-Ipkorecgu3o0c5nxZVT-B7_TSfJqYUwBqTBLeEXLQH30Xb0bFWhheNIlxtrSTwKhX8DFq0lRWljby8NAX13BHHDQEVlCnDkx6eDcF=w426-h240-k-no
